A3: UF | C3: ESxx | D3: INSS | F3: MPS | G3: TOTAL
4: 1 | A4: AC | C4: 57 | D4: 80 | G4: =SUM(E5:G5) -> 137
5: 2 | A5: AL | C5: 4 | G5: =SUM(E6:G6) -> 4
6: 3 | A6: BA | C6: 88 | G6: =SUM(E7:G7) -> 88
7: 4 | A7: CE | C7: 88 | D7: 403 | G7: =SUM(E7:G7) -> 491
8: 5 | A8: DF | C8: 174 | G8: =SUM(E8:G8) -> 174
9: 6 | A9: ES | C9: 63 | D9: 658 | F9: 27 | G9: =SUM(E9:G9) -> 748
10: 7 | A10: GO | C10: 44 | D10: 388 | G10: =SUM(E10:G10) -> 432
11: 8 | A11: MA | C11: 28 | D11: 104 | G11: =SUM(E11:G11) -> 132
12: 9 | A12: MG | C12: 101 | D12: 264 | G12: =SUM(E12:G12) -> 365
13: 10 | A13: MS | C13: 25 | G13: =SUM(E13:G13) -> 25
14: 11 | A14: MT | C14: 23 | D14: 112 | G14: =SUM(E14:G14) -> 135
15: 12 | A15: PB | C15: 60 | D15: 427 | G15: =SUM(E15:G15) -> 487
16: 13 | A16: PE | C16: 38 | G16: =SUM(E16:G16) -> 38
17: 14 | A17: PI | C17: 31 | D17: 44 | G17: =SUM(E17:G17) -> 75
18: 15 | A18: PR | C18: 22 | D18: 657 | G18: =SUM(E18:G18) -> 679
19: 16 | A19: RJ | C19: 104 | G19: =SUM(E18:G18) -> 104
20: 17 | A20: RO | C20: 15 | D20: 172 | G20: =SUM(E19:G19) -> 187
21: 18 | A21: RS | C21: 108 | D21: 834 | F21: 15 | G21: =SUM(E20:G20) -> 957
22: 19 | A22: SC | C22: 46 | G22: =SUM(E21:G21) -> 46
23: 20 | A23: SE | C23: 39 | D23: 6 | G23: =SUM(E22:G22) -> 45
24: 21 | A24: SP | C24: 165 | D24: 580 | G24: =SUM(E23:G23) -> 745
C25: 1.323 | D25: 4.729 | F25: 42 | G25: =SUM(E23:G23) -> 6.094
G26: =SUM(H5:H23) -> 3312